"product_name","product_id","qty"
"Logitech P710e Mobile Speakerphone","TEC-AC-10003832",75
"Xerox 1881","OFF-PA-10001970",70
"GBC Premium Transparent Covers with Diagonal Lined Pattern","OFF-BI-10001524",67
"Situations Contoured Folding Chairs, 4/Set","FUR-CH-10002647",64
"Avery Arch Ring Binders","OFF-BI-10002026",64
"Chromcraft Round Conference Tables","FUR-TA-10001095",61
"Logitech G19 Programmable Gaming Keyboard","TEC-AC-10002049",60
"Wilson Jones Turn Tabs Binder Tool for Ring Binders","OFF-BI-10004728",59
"Global Wood Trimmed Manager's Task Chair, Khaki","FUR-CH-10003774",59
"DAX Wood Document Frame","FUR-FU-10001473",57
"Kingston Digital DataTraveler 16GB USB 2.0","TEC-AC-10003038",57
"Fellowes Officeware Wire Shelving","OFF-ST-10001809",55
"Global High-Back Leather Tilter, Burgundy","FUR-CH-10002880",54
"SAFCO Arco Folding Chair","FUR-CH-10004287",53
"Xerox 226","OFF-PA-10003441",53
"Logitech 910-002974 M325 Wireless Mouse for Web Scrolling","TEC-AC-10003628",52
"I Need's 3d Hello Kitty Hybrid Silicone Case Cover for HTC One X 4g with 3d Hello Kitty Stylus Pen Green/pink","TEC-PH-10001552",52
"Xerox 1916","OFF-PA-10002377",52
"Flat Face Poster Frame","FUR-FU-10004973",51
"Eldon Image Series Desk Accessories, Burgundy","FUR-FU-10004270",51
"Hon Deluxe Fabric Upholstered Stacking Chairs, Rounded Back","FUR-CH-10000454",51
"Avery 485","OFF-LA-10002762",51
"Global Value Mid-Back Manager's Chair, Gray","FUR-CH-10001146",51
"GBC Standard Recycled Report Covers, Clear Plastic Sheets","OFF-BI-10003676",51
"Logitech Desktop MK120 Mouse and keyboard Combo","TEC-AC-10004510",50
"Fellowes Bankers Box Stor/Drawer Steel Plus","OFF-ST-10000563",50
"Avery Durable Binders","OFF-BI-10000546",50
"GBC DocuBind P50 Personal Binding Machine","OFF-BI-10001718",50
"GBC Instant Report Kit","OFF-BI-10000301",50
"Iceberg Mobile Mega Data/Printer Cart ","OFF-ST-10001526",49
"Hot File 7-Pocket, Floor Stand","OFF-ST-10001490",49
"Newell 312","OFF-AR-10004078",49
"Maxell 4.7GB DVD-R","TEC-AC-10002473",49
"Wilson Jones Easy Flow II Sheet Lifters","OFF-BI-10002012",49
"Pressboard Hanging Data Binders for Unburst Sheets","OFF-BI-10001757",48
"White Dual Perf Computer Printout Paper, 2700 Sheets, 1 Part, Heavyweight, 20 lbs., 14 7/8 x 11","OFF-PA-10000357",48
"GBC Ibimaster 500 Manual ProClick Binding System","OFF-BI-10000545",48
"Wilson Jones Century Plastic Molded Ring Binders","OFF-BI-10003982",48
"Wilson Jones Ledger-Size, Piano-Hinge Binder, 2, Blue","OFF-BI-10001597",47
"KI Adjustable-Height Table","FUR-TA-10001039",47
"Tennsco Double-Tier Lockers","OFF-ST-10003716",47
"GBC Twin Loop Wire Binding Elements","OFF-BI-10002082",47
"Advantus Plastic Paper Clips","OFF-FA-10002280",47
"Wilson Jones Clip & Carry Folder Binder Tool for Ring Binders, Clear","OFF-BI-10000174",47
"Ibico Plastic Spiral Binding Combs","OFF-BI-10000977",47
"Bretford Rectangular Conference Table Tops","FUR-TA-10003473",46
"Geemarc AmpliPOWER60","TEC-PH-10003505",46
"Xerox 1898","OFF-PA-10002986",46
"Premier Elliptical Ring Binder, Black","OFF-BI-10002429",46
"SAFCO Boltless Steel Shelving","OFF-ST-10002743",46
"Wilson Jones Leather-Like Binders with DublLock Round Rings","OFF-BI-10003291",46
"Wilson Jones 1 Hanging DublLock Ring Binders","OFF-BI-10001116",46
"Howard Miller 14-1/2 Diameter Chrome Round Wall Clock","FUR-FU-10004864",46
"Ibico Hi-Tech Manual Binding System","OFF-BI-10004632",45
"Memorex Mini Travel Drive 16 GB USB 2.0 Flash Drive","TEC-AC-10001772",45
"Adjustable Depth Letter/Legal Cart","OFF-ST-10003208",45
"Acco Pressboard Covers with Storage Hooks, 14 7/8 x 11, Light Blue","OFF-BI-10003712",45
"Eldon Shelf Savers Cubes and Bins","OFF-ST-10002486",45
"Eldon Wave Desk Accessories","FUR-FU-10000023",45
"Xerox 1945","OFF-PA-10000100",45
"OIC Colored Binder Clips, Assorted Sizes","OFF-FA-10000621",44
"Global Stack Chair without Arms, Black","FUR-CH-10002304",44
"Zipper Ring Binder Pockets","OFF-BI-10000145",44
"ACCOHIDE 3-Ring Binder, Blue, 1","OFF-BI-10004970",44
"Hon Olson Stacker Stools","FUR-CH-10000988",44
"Longer-Life Soft White Bulbs","FUR-FU-10001706",44
"SanDisk Ultra 32 GB MicroSDHC Class 10 Memory Card","TEC-AC-10002323",44
"4009 Highlighters by Sanford","OFF-AR-10003514",44
"KI Conference Tables","FUR-TA-10002607",44
"Wilson Jones Legal Size Ring Binders","OFF-BI-10003684",44
"Lock-Up Easel 'Spel-Binder'","OFF-BI-10003984",44
"Avery File Folder Labels","OFF-LA-10001613",44
"Pressboard Covers with Storage Hooks, 9 1/2 x 11, Light Blue","OFF-BI-10000343",44
"Hunt PowerHouse Electric Pencil Sharpener, Blue","OFF-AR-10000380",44
"Howard Miller 13-3/4 Diameter Brushed Chrome Round Wall Clock","FUR-FU-10004848",44
"Global Push Button Manager's Chair, Indigo","FUR-CH-10004477",44
"Premium Transparent Presentation Covers by GBC","OFF-BI-10001989",43
"Global Value Steno Chair, Gray","FUR-CH-10003817",43
"Acco Perma 3000 Stacking Storage Drawers","OFF-ST-10004950",43
"Dual Level, Single-Width Filing Carts","OFF-ST-10002615",43
"Avery 4027 File Folder Labels for Dot Matrix Printers, 5000 Labels per Box, White","OFF-LA-10003510",43
"Tennsco 6- and 18-Compartment Lockers","OFF-ST-10000078",43
"Hon Every-Day Series Multi-Task Chairs","FUR-CH-10004997",43
"Pyle PMP37LED","TEC-PH-10001557",43
"Fellowes Bankers Box Staxonsteel Drawer File/Stacking System","OFF-ST-10000060",43
"Wilson Jones Elliptical Ring 3 1/2 Capacity Binders, 800 sheets","OFF-BI-10002133",42
"Wilson Jones Impact Binders","OFF-BI-10004040",42
"Microsoft Sculpt Comfort Mouse","TEC-AC-10004469",42
"High-Back Leather Manager's Chair","FUR-CH-10000513",42
"DMI Eclipse Executive Suite Bookcases","FUR-BO-10002213",42
"Fellowes Twister Kit, Gray/Clear, 3/pkg","OFF-BI-10004209",42
"Xerox 216","OFF-PA-10004100",42
"Angle-D Binders with Locking Rings, Label Holders","OFF-BI-10000050",42
"GBC VeloBind Cover Sets","OFF-BI-10002353",42
"GBC Recycled VeloBinder Covers","OFF-BI-10004001",42
"Ibico Plastic and Wire Spiral Binding Combs","OFF-BI-10001636",41
"Avery Reinforcements for Hole-Punch Pages","OFF-BI-10002813",41
"Aluminum Screw Posts","OFF-BI-10003707",41
"Xerox 1988","OFF-PA-10001125",41
"Cardinal HOLDit! Binder Insert Strips,Extra Strips","OFF-BI-10003429",41
"Avery Heavy-Duty EZD View Binder with Locking Rings","OFF-BI-10001249",41
"Motorola HK250 Universal Bluetooth Headset","TEC-PH-10003555",41
"Avery Self-Adhesive Photo Pockets for Polaroid Photos","OFF-BI-10002982",41
"Fellowes Basic Home/Office Series Surge Protectors","OFF-AP-10000358",41
"Maxell LTO Ultrium - 800 GB","TEC-AC-10004568",41
"Acco Six-Outlet Power Strip, 4' Cord Length","OFF-AP-10001492",41
"Tenex Personal Project File with Scoop Front Design, Black","OFF-ST-10001590",40
"Honeywell Enviracaire Portable HEPA Air Cleaner for 17' x 22' Room","OFF-AP-10002945",40
"Fellowes Mobile File Cart, Black","OFF-ST-10004340",40
"Belkin 5 Outlet SurgeMaster Power Centers","OFF-AP-10001205",40
"Xerox 1919","OFF-PA-10000675",40
"Avery 499","OFF-LA-10001569",40
"SlimView Poly Binder, 3/8","OFF-BI-10002799",40
"Vinyl Sectional Post Binders","OFF-BI-10001670",40
"Cardinal EasyOpen D-Ring Binders","OFF-BI-10001036",40
"Crayola Colored Pencils","OFF-AR-10004757",40
"Xerox 1909","OFF-PA-10003641",40
"Bevis 36 x 72 Conference Tables","FUR-TA-10003748",40
"Standard Rollaway File with Lock","OFF-ST-10001496",40
"Polycom VVX 310 VoIP phone","TEC-PH-10000895",40
"Lesro Sheffield Collection Coffee Table, End Table, Center Table, Corner Table","FUR-TA-10001520",39
"Novimex Fabric Task Chair","FUR-CH-10003833",39
"Round Specialty Laser Printer Labels","OFF-LA-10001074",39
"Carina Double Wide Media Storage Towers in Natural & Black","OFF-ST-10000736",39
"HON 5400 Series Task Chairs for Big and Tall","FUR-CH-10002024",39
"Howard Miller 13 Diameter Goldtone Round Wall Clock","FUR-FU-10004091",39
"Global Ergonomic Managers Chair","FUR-CH-10000785",39
"GBC Prestige Therm-A-Bind Covers","OFF-BI-10002735",39
"Nu-Dell Executive Frame","FUR-FU-10002501",39
"Memorex Micro Travel Drive 16 GB","TEC-AC-10002006",39
"XtraLife ClearVue Slant-D Ring Binder, White, 3","OFF-BI-10004236",39
"Xerox 191","OFF-PA-10000157",39
"Global Leather Highback Executive Chair with Pneumatic Height Adjustment, Black","FUR-CH-10002965",39
"Adams Phone Message Book, Professional, 400 Message Capacity, 5 3/6” x 11”","OFF-PA-10000659",39
"Acco Data Flex Cable Posts For Top & Bottom Load Binders, 6 Capacity","OFF-BI-10001628",39
"Storex DuraTech Recycled Plastic Frosted Binders","OFF-BI-10000756",39
"Samsung Galaxy Mega 6.3","TEC-PH-10001459",39
"Xerox 1893","OFF-PA-10001033",39
"Satellite Sectional Post Binders","OFF-BI-10000632",38
"Master Caster Door Stop, Brown","FUR-FU-10000221",38
"Hewlett Packard LaserJet 3310 Copier","TEC-CO-10001449",38
"Strathmore Photo Mount Cards","OFF-PA-10003673",38
"GBC Prepunched Paper, 19-Hole, for Binding Systems, 24-lb","OFF-BI-10000069",38
"OIC Binder Clips","OFF-FA-10000624",38
"Fellowes PB200 Plastic Comb Binding Machine","OFF-BI-10003656",38
"Storex Dura Pro Binders","OFF-BI-10004364",38
"Sensible Storage WireTech Storage Systems","OFF-ST-10001370",38
"Staple-based wall hangings","FUR-FU-10001940",38
"Westinghouse Clip-On Gooseneck Lamps","FUR-FU-10003724",38
"Avery 476","OFF-LA-10004484",37
"Acrylic Self-Standing Desk Frames","FUR-FU-10001731",37
"GBC DocuBind TL300 Electric Binding System","OFF-BI-10001359",37
"Xerox 1883","OFF-PA-10002254",37
"DMI Arturo Collection Mission-style Design Wood Chair","FUR-CH-10002602",37
"Fellowes Stor/Drawer Steel Plus Storage Drawers","OFF-ST-10000025",37
"Acco Pressboard Covers with Storage Hooks, 14 7/8 x 11, Executive Red","OFF-BI-10001525",37
"Cardinal Slant-D Ring Binder, Heavy Gauge Vinyl","OFF-BI-10002103",37
"Xerox 214","OFF-PA-10001972",37
"Alphabetical Labels for Top Tab Filing","OFF-LA-10003923",37
"Jabra SPEAK 410","TEC-PH-10002103",37
"REDIFORM Incoming/Outgoing Call Register, 11 X 8 1/2, 100 Messages","OFF-PA-10000380",37
"Staples","OFF-FA-10002780",37
"White Computer Printout Paper by Universal","OFF-PA-10001289",37
"O'Sullivan 4-Shelf Bookcase in Odessa Pine","FUR-BO-10001972",37
"Acco PRESSTEX Data Binder with Storage Hooks, Dark Blue, 14 7/8 X 11","OFF-BI-10001078",37
"Acco 3-Hole Punch","OFF-BI-10003460",36
"Tensor Computer Mounted Lamp","FUR-FU-10004018",36
"Fellowes Personal Hanging Folder Files, Navy","OFF-ST-10001228",36
"12-1/2 Diameter Round Wall Clock","FUR-FU-10002759",36
"Xerox 1931","OFF-PA-10000019",36
"Avery Non-Stick Binders","OFF-BI-10004140",36
"Acco Flexible ACCOHIDE Square Ring Data Binder, Dark Blue, 11 1/2 X 14 7/8","OFF-BI-10000962",36
"Dot Matrix Printer Tape Reel Labels, White, 5000/Box","OFF-LA-10003930",36
"Avery Durable Slant Ring Binders With Label Holder","OFF-BI-10003727",36
"Avery Durable Slant Ring Binders, No Labels","OFF-BI-10003274",36
"Performers Binder/Pad Holder, Black","OFF-BI-10002854",36
"Acme Hot Forged Carbon Steel Scissors with Nickel-Plated Handles, 3 7/8 Cut, 8L","OFF-SU-10000898",36
"Bevis Oval Conference Table, Walnut","FUR-TA-10002958",36
"Hon Multipurpose Stacking Arm Chairs","FUR-CH-10000015",36
"GBC Imprintable Covers","OFF-BI-10000088",36
"DAX Value U-Channel Document Frames, Easel Back","FUR-FU-10000010",36
"Avery Binding System Hidden Tab Executive Style Index Sets","OFF-BI-10004654",36
"Catalog Binders with Expanding Posts","OFF-BI-10004224",36
"Kensington 4 Outlet MasterPiece Compact Power Control Center","OFF-AP-10004487",36
"Global Deluxe High-Back Manager's Chair","FUR-CH-10004063",35
"Staple envelope","OFF-EN-10003286",35
"Staples","OFF-FA-10003495",35
"Avery 518","OFF-LA-10001641",35
"Wirebound Message Book, 4 per Page","OFF-PA-10003724",35
"Atlantic Metals Mobile 3-Shelf Bookcases, Custom Colors","FUR-BO-10002545",35
"Eldon ProFile File 'N Store Portable File Tub Letter/Legal Size Black","OFF-ST-10000943",35
"Sterilite Officeware Hinged File Box","OFF-ST-10001325",35
"Redi-Strip #10 Envelopes, 4 1/8 x 9 1/2","OFF-EN-10002600",35
"SAFCO Commercial Wire Shelving, Black","OFF-ST-10002574",35
"Crayola Anti Dust Chalk, 12/Pack","OFF-AR-10003759",35
"Avery Non-Stick Binders","OFF-BI-10000829",35
"Decoflex Hanging Personal Folder File, Blue","OFF-ST-10001321",35
"Acco 6 Outlet Guardian Premium Surge Suppressor","OFF-AP-10004859",35
"Plantronics CS510 - Over-the-Head monaural Wireless Headset System","TEC-AC-10003033",35
"Southworth 100% Résumé Paper, 24lb.","OFF-PA-10002137",35
"Poly Designer Cover & Back","OFF-BI-10000315",35
"Poly String Tie Envelopes","OFF-EN-10001509",35
"AT&T 17929 Lendline Telephone","TEC-PH-10002890",35
"Global Fabric Manager's Chair, Dark Gray","FUR-CH-10004218",35
"WD My Passport Ultra 2TB Portable External Hard Drive","TEC-AC-10002842",35
"GBC Twin Loop Wire Binding Elements, 9/16 Spine, Black","OFF-BI-10000309",35
"Office Star - Contemporary Task Swivel chair with Loop Arms, Charcoal","FUR-CH-10003298",35
"DXL Angle-View Binders with Locking Rings by Samsill","OFF-BI-10003910",35
"Self-Adhesive Removable Labels","OFF-LA-10003766",35
"Recycled Easel Ring Binders","OFF-BI-10002824",35
"Ibico Laser Imprintable Binding System Covers","OFF-BI-10004593",34
"Newell 325","OFF-AR-10001419",34
"Avery Poly Binder Pockets","OFF-BI-10001890",34
"Eldon Portable Mobile Manager","OFF-ST-10003442",34
"Plantronics Audio 478 Stereo USB Headset","TEC-AC-10002800",34
"Ibico Standard Transparent Covers","OFF-BI-10002852",34
"SanDisk Cruzer 64 GB USB Flash Drive","TEC-AC-10001465",34
"Stockwell Push Pins","OFF-FA-10001561",34
"PureGear Roll-On Screen Protector","TEC-PH-10000011",34
"Hon GuestStacker Chair","FUR-CH-10002335",34
"Wirebound Message Books, Four 2 3/4 x 5 White Forms per Page","OFF-PA-10000575",34
"Bush Andora Bookcase, Maple/Graphite Gray Finish","FUR-BO-10004015",34
"Cisco Unified IP Phone 7945G VoIP phone","TEC-PH-10001530",34
"GBC Standard Therm-A-Bind Covers","OFF-BI-10001658",34
"Accohide Poly Flexible Ring Binders","OFF-BI-10003196",34
"Harbour Creations Steel Folding Chair","FUR-CH-10001270",34
"Avery Durable Plastic 1 Binders","OFF-BI-10003981",34
"Fellowes Black Plastic Comb Bindings","OFF-BI-10002071",34
"Hon 4070 Series Pagoda Armless Upholstered Stacking Chairs","FUR-CH-10004086",34
"White Business Envelopes with Contemporary Seam, Recycled White Business Envelopes","OFF-EN-10001335",34
"Bush Heritage Pine Collection 5-Shelf Bookcase, Albany Pine Finish, *Special Order","FUR-BO-10004218",34
"Mitel MiVoice 5330e IP Phone","TEC-PH-10004165",34
"Recycled Pressboard Report Cover with Reinforced Top Hinge","OFF-BI-10002764",34
"Ultra Door Push Plate","FUR-FU-10002268",34
"9-3/4 Diameter Round Wall Clock","FUR-FU-10000629",34
"GBC Durable Plastic Covers","OFF-BI-10003638",34
"Easy-staple paper","OFF-PA-10000474",34
"Xerox 1978","OFF-PA-10002160",34
"File Shuttle II and Handi-File, Black","OFF-ST-10000675",34
"Global Highback Leather Tilter in Burgundy","FUR-CH-10000422",34
"Kensington Orbit Wireless Mobile Trackball for PC and Mac","TEC-AC-10001990",33
"RSVP Cards & Envelopes, Blank White, 8-1/2 X 11, 24 Cards/25 Envelopes/Set","OFF-PA-10002195",33
"Space Solutions Commercial Steel Shelving","OFF-ST-10001511",33
"Xerox 1895","OFF-PA-10002245",33
"Avery Durable Poly Binders","OFF-BI-10002827",33
"Letter Size Cart","OFF-ST-10003306",33
"Global Commerce Series High-Back Swivel/Tilt Chairs","FUR-CH-10003379",33
"Eldon Expressions Wood Desk Accessories, Oak","FUR-FU-10002364",33
"GBC Velobind Prepunched Cover Sets, Regency Series","OFF-BI-10004330",33
"Perma STOR-ALL Hanging File Box, 13 1/8W x 12 1/4D x 10 1/2H","OFF-ST-10001505",33
"Deflect-o EconoMat Studded, No Bevel Mat for Low Pile Carpeting","FUR-FU-10000723",33
"Newell 333","OFF-AR-10003732",33
"Fellowes Strictly Business Drawer File, Letter/Legal Size","OFF-ST-10000689",33
"Ideal Clamps","OFF-FA-10002988",33
"Xerox 1952","OFF-PA-10000477",33
"Tennsco Stur-D-Stor Boltless Shelving, 5 Shelves, 24 Deep, Sand","OFF-ST-10002756",33
"Xerox 225","OFF-PA-10002005",33
"Electrix Architect's Clamp-On Swing Arm Lamp, Black","FUR-FU-10003664",33
"Adams Phone Message Book, 200 Message Capacity, 8 1/16” x 11”","OFF-PA-10002713",33
"Deluxe Heavy-Duty Vinyl Round Ring Binder","OFF-BI-10001510",33
"Bush Advantage Collection Racetrack Conference Table","FUR-TA-10001889",33
"Xerox 1964","OFF-PA-10001954",33
"Storex Dura Pro Binders","OFF-BI-10001922",33
"3M Hangers With Command Adhesive","FUR-FU-10001935",33
"Bush Westfield Collection Bookcases, Medium Cherry Finish","FUR-BO-10004709",32
"Office Star - Contemporary Swivel Chair with Padded Adjustable Arms and Flex Back","FUR-CH-10001708",32
"Avery Recycled Flexi-View Covers for Binding Systems","OFF-BI-10000474",32
"SimpliFile Personal File, Black Granite, 15w x 6-15/16d x 11-1/4h","OFF-ST-10000615",32
"Acme Forged Steel Scissors with Black Enamel Handles","OFF-SU-10000381",32
"Global Airflow Leather Mesh Back Chair, Black","FUR-CH-10000665",32
"Nortel Meridian M3904 Professional Digital phone","TEC-PH-10003012",32
"Boston School Pro Electric Pencil Sharpener, 1670","OFF-AR-10003373",32
"Imation Secure+ Hardware Encrypted USB 2.0 Flash Drive; 16GB","TEC-AC-10004659",32
"Global Troy Executive Leather Low-Back Tilter","FUR-CH-10001215",32
"Global Chrome Stack Chair","FUR-CH-10004540",32
"Panasonic KX TS208W Corded phone","TEC-PH-10001305",32
"Newell 317","OFF-AR-10001246",32
"Wilson Electronics DB Pro Signal Booster","TEC-PH-10001817",32
"Great White Multi-Use Recycled Paper (20Lb. and 84 Bright)","OFF-PA-10001667",32
"Motorola L703CM","TEC-PH-10004094",32
"Prang Colored Pencils","OFF-AR-10003045",32
"Xerox 1960","OFF-PA-10003039",32
"#10 White Business Envelopes,4 1/8 x 9 1/2","OFF-EN-10004483",32
"Avery Hole Reinforcements","OFF-BI-10001097",32
"Avery 512","OFF-LA-10004689",32
"Rogers Profile Extra Capacity Storage Tub","OFF-ST-10000636",32
"Memorex Froggy Flash Drive 8 GB","TEC-AC-10003116",32
"Newell 347","OFF-AR-10003504",32
"Logitech Wireless Headset h800","TEC-AC-10001908",32
"Binding Machine Supplies","OFF-BI-10003364",32
"Vtech CS6719","TEC-PH-10000526",32
"Xerox 1884","OFF-PA-10001019",32
"Xerox 1906","OFF-PA-10003302",32
"GE 30524EE4","TEC-PH-10004977",32
"GBC White Gloss Covers, Plain Front","OFF-BI-10001107",31
"Avery Metallic Poly Binders","OFF-BI-10003476",31
"Logitech diNovo Edge Keyboard","TEC-AC-10004145",31
"SAFCO Mobile Desk Side File, Wire Frame","OFF-ST-10001837",31
"Acme Box Cutter Scissors","OFF-SU-10002537",31
"Belkin 19 Vented Equipment Shelf, Black","OFF-ST-10004804",31
"Avery Hi-Liter EverBold Pen Style Fluorescent Highlighters, 4/Pack","OFF-AR-10003478",31
"Acco 6 Outlet Guardian Premium Plus Surge Suppressor","OFF-AP-10001947",31
"Advantus Rolling Drawer Organizers","OFF-ST-10000532",31
"GBC ProClick Punch Binding System","OFF-BI-10001071",31
"Acco 7-Outlet Masterpiece Power Center, Wihtout Fax/Phone Line Protection","OFF-AP-10002684",31
"Office Star - Mid Back Dual function Ergonomic High Back Chair with 2-Way Adjustable Arms","FUR-CH-10004983",31
"Acco Translucent Poly Ring Binders","OFF-BI-10000138",31
"Hoover Upright Vacuum With Dirt Cup","OFF-AP-10002651",31
"SanDisk Ultra 16 GB MicroSDHC Class 10 Memory Card","TEC-AC-10004227",31
"O'Sullivan 2-Door Barrister Bookcase in Odessa Pine","FUR-BO-10004695",31
"GBC Pre-Punched Binding Paper, Plastic, White, 8-1/2 x 11","OFF-BI-10004233",31
"Bestar Classic Bookcase","FUR-BO-10004467",31
"Acco D-Ring Binder w/DublLock","OFF-BI-10001098",31
"Bulldog Vacuum Base Pencil Sharpener","OFF-AR-10004344",31
"Iceberg Nesting Folding Chair, 19w x 6d x 43h","FUR-CH-10002439",31
"Acco Perma 4000 Stacking Storage Drawers","OFF-ST-10001558",31
"GuestStacker Chair with Chrome Finish Legs","FUR-CH-10003973",31
"Global Stack Chair with Arms, Black","FUR-CH-10004754",31
"C-Line Cubicle Keepers Polyproplyene Holder With Velcro Backings","FUR-FU-10001918",31
"Toshiba IPT2010-SD IP Telephone","TEC-PH-10004447",31
"Personal Filing Tote with Lid, Black/Gray","OFF-ST-10001328",31
"Logitech Gaming G510s - Keyboard","TEC-AC-10000844",31
"Fellowes PB500 Electric Punch Plastic Comb Binding Machine with Manual Bind","OFF-BI-10003527",31
"Fellowes Binding Cases","OFF-BI-10001294",31
"Peel-Off China Markers","OFF-AR-10001915",31
"Fellowes Superior 10 Outlet Split Surge Protector","OFF-AP-10004708",30
"X-Rack File for Hanging Folders","OFF-ST-10002214",30
"Xerox 1951","OFF-PA-10002581",30
"Global Super Steno Chair","FUR-CH-10004289",30
"Eldon Mobile Mega Data Cart  Mega Stackable  Add-On Trays","OFF-ST-10003058",30
"Iris Project Case","OFF-ST-10002352",30
"Avery 481","OFF-LA-10002195",30
"Safco Industrial Wire Shelving System","OFF-ST-10004123",30
"OIC Stacking Trays","FUR-FU-10000320",30
"Rogers Handheld Barrel Pencil Sharpener","OFF-AR-10001662",30
"Xerox 4200 Series MultiUse Premium Copy Paper (20Lb. and 84 Bright)","OFF-PA-10002479",30
"Peel & Stick Add-On Corner Pockets","OFF-BI-10004656",30
"GBC Standard Plastic Binding Systems' Combs","OFF-BI-10001308",30
"Xerox 1887","OFF-PA-10000176",30
"GBC Plastic Binding Combs","OFF-BI-10000320",30
"Presstex Flexible Ring Binders","OFF-BI-10002557",30
"Master Big Foot Doorstop, Beige","FUR-FU-10003142",30
"Eldon Simplefile Box Office","OFF-ST-10000876",30
"Home/Office Personal File Carts","OFF-ST-10000604",30
"Xerox 1891","OFF-PA-10001878",30
"Xerox 1997","OFF-PA-10003848",30
"Hon 94000 Series Round Tables","FUR-TA-10003954",30
"Belkin 8 Outlet Surge Protector","OFF-AP-10001293",30
"Manco Dry-Lighter Erasable Highlighter","OFF-AR-10000817",30
"Staples in misc. colors","OFF-AR-10003631",30
"Newell 35","OFF-AR-10003829",30
"Padded Folding Chairs, Black, 4/Carton","FUR-CH-10004698",30
"Razer Kraken PRO Over Ear PC and Music Headset","TEC-AC-10002402",30
"Chromcraft Rectangular Conference Tables","FUR-TA-10001539",30
"Sanford Colorific Colored Pencils, 12/Box","OFF-AR-10001149",30
"Cisco SPA301","TEC-PH-10002496",30
"Trav-L-File Heavy-Duty Shuttle II, Black","OFF-ST-10002974",30
"Verbatim 25 GB 6x Blu-ray Single Layer Recordable Disc, 3/Pack","TEC-AC-10004633",30
"Globe Weis Peel & Seel First Class Envelopes","OFF-EN-10002500",30
"Hon Metal Bookcases, Black","FUR-BO-10001608",30
"GBC VeloBinder Manual Binding System","OFF-BI-10001543",30
"Holmes Odor Grabber","OFF-AP-10000696",30
"BOSTON Model 1800 Electric Pencil Sharpeners, Putty/Woodgrain","OFF-AR-10004042",30
"Recycled Desk Saver Line While You Were Out Book, 5 1/2 X 4","OFF-PA-10001509",30
"Mediabridge Sport Armband iPhone 5s","TEC-PH-10004897",30
"Iceberg OfficeWorks 42 Round Tables","FUR-TA-10002530",30
"OIC Bulk Pack Metal Binder Clips","OFF-FA-10000585",30
"Samsung Galaxy Note 2","TEC-PH-10002200",30
"Avery 474","OFF-LA-10003190",30
"SANFORD Major Accent Highlighters","OFF-AR-10002445",30
"Logitech Wireless Marathon Mouse M705","TEC-AC-10002926",30
"Newell 311","OFF-AR-10001547",30
"Razer Kraken 7.1 Surround Sound Over Ear USB Gaming Headset","TEC-AC-10004171",29
"Astroparche Fine Business Paper","OFF-PA-10000143",29
"Hon Non-Folding Utility Tables","FUR-TA-10004619",29
"Bretford CR4500 Series Slim Rectangular Table","FUR-TA-10000577",29
"Belkin 6 Outlet Metallic Surge Strip","OFF-AP-10003971",29
"BIC Brite Liner Grip Highlighters, Assorted, 5/Pack","OFF-AR-10000034",29
"Premium Writing Pencils, Soft, #2 by Central Association for the Blind","OFF-AR-10002053",29
"invisibleSHIELD by ZAGG Smudge-Free Screen Protector","TEC-PH-10003589",29
"GE 48 Fluorescent Tube, Cool White Energy Saver, 34 Watts, 30/Box","FUR-FU-10002937",29
"Easy-staple paper","OFF-PA-10001685",29
"Clear Mylar Reinforcing Strips","OFF-BI-10002498",29
"Belkin 7 Outlet SurgeMaster II","OFF-AP-10000576",29
"Surelock Post Binders","OFF-BI-10000666",29
"Bravo II Megaboss 12-Amp Hard Body Upright, Replacement Belts, 2 Belts per Pack","OFF-AP-10003622",29
"Steel Personal Filing/Posting Tote","OFF-ST-10001476",29
"Nortel Networks T7316 E Nt8 B27","TEC-PH-10002660",29
"Belkin F9H710-06 7 Outlet SurgeMaster Surge Protector","OFF-AP-10002350",29
"Heavy-Duty E-Z-D Binders","OFF-BI-10000014",29
"Enermax Acrylux Wireless Keyboard","TEC-AC-10003198",29
"Xerox 209","OFF-PA-10003797",29
"Revere Boxed Rubber Bands by Revere","OFF-FA-10000053",29
"Vinyl Coated Wire Paper Clips in Organizer Box, 800/Box","OFF-FA-10004854",29
"Logitech G602 Wireless Gaming Mouse","TEC-AC-10002567",29
"Sony Micro Vault Click 16 GB USB 2.0 Flash Drive","TEC-AC-10000109",29
"Global Deluxe Steno Chair","FUR-CH-10003396",29
"Acco Suede Grain Vinyl Round Ring Binder","OFF-BI-10004022",29
"Permanent Self-Adhesive File Folder Labels for Typewriters, 1 1/8 x 3 1/2, White","OFF-LA-10002945",29
"Microsoft Natural Keyboard Elite","TEC-AC-10002076",29
"Tennsco Industrial Shelving","OFF-ST-10002554",29
"Premium Transparent Presentation Covers, No Pattern/Clear, 8 1/2 x 11","OFF-BI-10003007",29
"Black & Decker Filter for Double Action Dustbuster Cordless Vac BLDV7210","OFF-AP-10001962",28
"Cameo Buff Policy Envelopes","OFF-EN-10000056",28
"Newell 319","OFF-AR-10001955",28
"Xerox 202","OFF-PA-10001870",28
"Samsung Galaxy S III - 16GB - pebble blue (T-Mobile)","TEC-PH-10000560",28
"Xerox 1949","OFF-PA-10001526",28
"Acco Pressboard Covers with Storage Hooks, 9 1/2 x 11, Executive Red","OFF-BI-10000605",28
"O'Sullivan Living Dimensions 2-Shelf Bookcases","FUR-BO-10001337",28
"Avery Address/Shipping Labels for Typewriters, 4 x 2","OFF-LA-10001158",28
"Xerox 1915","OFF-PA-10000994",28
"Xerox 1962","OFF-PA-10003893",28
"Acco Four Pocket Poly Ring Binder with Label Holder, Smoke, 1","OFF-BI-10003708",28
"AT&T 841000 Phone","TEC-PH-10004614",28
"Advantus Employee of the Month Certificate Frame, 11 x 13-1/2","FUR-FU-10001185",28
"LF Elite 3D Dazzle Designer Hard Case Cover, Lf Stylus Pen and Wiper For Apple Iphone 5c Mini Lite","TEC-PH-10003988",28
"Xerox 1971","OFF-PA-10000327",28
"Snap-A-Way Black Print Carbonless Ruled Speed Letter, Triplicate","OFF-PA-10000482",28
"C-Line Magnetic Cubicle Keepers, Clear Polypropylene","FUR-FU-10002597",28
"Dixon Ticonderoga Core-Lock Colored Pencils","OFF-AR-10003179",28
